{
  "category": "Smart Home",
  "version": 1,
  "name": "Zigbee2MQTT",
  "port": 8080,
  "description": "Zigbee2MQTT bridges Zigbee devices to MQTT without requiring a proprietary gateway.",
  "website": "https://www.zigbee2mqtt.io",
  "dockerImage": "docker.io/koenkk/zigbee2mqtt:latest",
  "dockerPorts": [],
  "dockerNetworkMode": "bridge",
  "dockerVolumes": {
    "zigbee2mqtt-data": "/app/data",
    "/run/udev": "/run/udev:ro"
  },
  "dockerEnvironment": {
    "TZ": "$TIMEZONE"
  },
  "dockerPrivileged": true
}
