{
  "category": "Media",
  "version": 1,
  "name": "Immich",
  "port": 2283,
  "description": "Immich is a self-hosted photo and video management solution.",
  "website": "https://immich.app",
  "dockerImage": "ghcr.io/immich-app/immich-server:release",
  "dockerPorts": [],
  "dockerNetworkMode": "bridge",
  "dockerVolumes": {
    "$REQUIRED": "/data"
  },
  "dockerEnvironment": {
    "DB_HOSTNAME": "postgres",
    "DB_USERNAME": "postgres",
    "DB_PASSWORD": "$REQUIRED",
    "DB_DATABASE_NAME": "immich",
    "REDIS_HOSTNAME": "redis",
    "TZ": "$TIMEZONE"
  }
}
