{
  "category": "Development",
  "version": 1,
  "name": "Forgejo",
  "port": 3000,
  "description": "Forgejo is a lightweight, community-driven Git hosting service with issues, pull requests, and packages.",
  "website": "https://forgejo.org",
  "dockerImage": "codeberg.org/forgejo/forgejo:16",
  "dockerPorts": [],
  "dockerNetworkMode": "bridge",
  "dockerVolumes": {
    "forgejo-data": "/data"
  },
  "dockerEnvironment": {
    "USER_UID": "1000",
    "USER_GID": "1000",
    "TZ": "$TIMEZONE"
  }
}
